{
  "algorithm_version": "theil-sen-sleep-start/v1",
  "confidence": {
    "level": "medium",
    "reasons": [
      "Synthetic contract example with explicit uncertainty."
    ]
  },
  "contains_synthetic_data": true,
  "forecasts": [
    {
      "predicted_sleep_window": {
        "end_at": "2026-09-03T04:00:00Z",
        "start_at": "2026-09-03T03:00:00Z",
        "zone_id": "UTC"
      },
      "predicted_waking_window": {
        "end_at": "2026-09-03T22:00:00Z",
        "start_at": "2026-09-03T12:00:00Z",
        "zone_id": "UTC"
      }
    }
  ],
  "freshness": {
    "explanation": "Based on recent synced sleep.",
    "reason": "",
    "state": "current"
  },
  "generated_at": "2026-09-02T12:00:00Z",
  "provenance": "self_hosted_synced_sleep",
  "schema_version": "v2",
  "sleep": [
    {
      "classification": "principal",
      "corrected": true,
      "end_at": "2026-09-02T10:00:00Z",
      "row_id": "sleep_synthetic",
      "start_at": "2026-09-02T02:02:00Z",
      "zone_id": "UTC"
    }
  ],
  "source_cursor": 2,
  "status": "estimated",
  "valid_until": "2026-09-02T12:15:00Z"
}
